{
  "$schema": "http://json-schema.org/draft-07/schema#",
  "$id": "gemuera:compatpack:manifest:schema:v1",
  "title": "gEmuera 兼容包清单 v1",
  "description": "兼容包程序集必须内嵌的资源 compatpack.manifest.json 的结构约束。运行期由 Emuera.Compatibility.Packs.CompatPackManifest 解析（fail-closed，未知字段整体拒绝）；本 schema 供包作者编辑器校验与文档对照。语义校验（capability id 词汇表命中、变体名与贡献对账、表面名单与引擎注册表对账）在加载器侧执行。",
  "type": "object",
  "required": [
    "packId",
    "packVersion",
    "targetEngineApi"
  ],
  "additionalProperties": false,
  "properties": {
    "packId": {
      "type": "string",
      "pattern": "^[a-z0-9][a-z0-9.\\-]*$",
      "description": "包唯一 id，沿用仓库方言模块 id 风格（如 game.erafl）。全局唯一，冲突拒载。"
    },
    "packVersion": {
      "type": "string",
      "pattern": "^[0-9]+\\.[0-9]+\\.[0-9]+$",
      "description": "语义化版本（x.y.z）。"
    },
    "targetEngineApi": {
      "description": "目标引擎 ModuleApiVersion，正整数（接受 JSON 数字或字符串形式）。主版本不匹配拒载。",
      "oneOf": [
        {
          "type": "integer",
          "minimum": 1
        },
        {
          "type": "string",
          "pattern": "^[1-9][0-9]*$"
        }
      ]
    },
    "baseProfileId": {
      "type": [
        "string",
        "null"
      ],
      "pattern": "^[a-z0-9][a-z0-9.\\-]*$",
      "description": "可选。包叠加的基线 profile；缺省 v24pure。宿主会与当前会话基线核对，不匹配拒载。"
    },
    "surface": {
      "type": [
        "object",
        "null"
      ],
      "additionalProperties": false,
      "description": "可选。纯数据表面名单（无需程序集入口代码）；指令名解析期 Trim+Upper、函数名保持原样，语义对账在加载器侧。",
      "properties": {
        "addInstructions": {
          "type": "array",
          "uniqueItems": true,
          "items": {
            "type": "string",
            "minLength": 1,
            "pattern": "^\\S+$"
          },
          "description": "新增可见指令名（必须已有引擎 handler）。"
        },
        "hideInstructions": {
          "type": "array",
          "uniqueItems": true,
          "items": {
            "type": "string",
            "minLength": 1,
            "pattern": "^\\S+$"
          },
          "description": "隐藏 v24 基线指令名。"
        },
        "addFunctions": {
          "type": "array",
          "uniqueItems": true,
          "items": {
            "type": "string",
            "minLength": 1,
            "pattern": "^\\S+$"
          },
          "description": "新增可见表达式函数名（必须已有引擎 handler；返回类型由引擎清单解析）。"
        },
        "hideFunctions": {
          "type": "array",
          "uniqueItems": true,
          "items": {
            "type": "string",
            "minLength": 1,
            "pattern": "^\\S+$"
          },
          "description": "隐藏 v24 基线函数名。"
        }
      }
    },
    "baseSurfaceHash": {
      "type": [
        "string",
        "null"
      ],
      "pattern": "^[0-9a-f]{8,64}$",
      "description": "可选。声明基于哪个 v24 表面快照（生成清单的规范化 SHA256，算法见 docs/designs/compat-pack-interface.md §12.9 / LegacySurfaceHash.ComputeV24SurfaceHash）；声明非空且与当前引擎基线不一致即拒载（v1 精确对账），不声明则不校验。"
    },
    "capabilities": {
      "type": [
        "array",
        "null"
      ],
      "uniqueItems": true,
      "items": {
        "type": "string",
        "pattern": "^[a-z0-9][a-z0-9.\\-]*$"
      },
      "description": "capability id 清单（复用引擎词汇表；未知 id 拒载）。"
    },
    "saveProfileId": {
      "type": [
        "string",
        "null"
      ],
      "pattern": "^[a-z0-9][a-z0-9.\\-]*$",
      "description": "可选。存档 profile id。"
    },
    "variantSelections": {
      "type": [
        "object",
        "null"
      ],
      "description": "指令名 → 变体名。v1 仅接受 builtin:*（引擎内置变体，未知内置名拒载）；v1 没有自带变体通道（IInstructionVariantContribution 为 v2 接线预留，携带即拒载，不经此字段）。",
      "additionalProperties": {
        "type": "string",
        "pattern": "^\\S+$"
      }
    },
    "gameIdentity": {
      "type": [
        "object",
        "null"
      ],
      "required": [
        "gameCode",
        "version"
      ],
      "additionalProperties": false,
      "description": "可选。绑定特定游戏：加载时与 GameBase.csv 比对，不匹配拒绝加载并回退纯 v24。",
      "properties": {
        "gameCode": {
          "type": "string",
          "minLength": 1,
          "description": "GameBase.csv コード 行（如 20250628）。"
        },
        "version": {
          "type": "string",
          "minLength": 1,
          "description": "GameBase.csv バージョン 行（如 305）。"
        },
        "versionAccept": {
          "type": "string",
          "enum": [
            "exact",
            "minor"
          ],
          "description": "版本容忍：exact（默认，精确匹配）或 minor（次级差异可接受）。"
        }
      }
    }
  }
}
