{
  "baseProfileId": "v24pure",
  "capabilities": [],
  "packId": "pack.gemuera.v18",
  "packVersion": "1.0.0",
  "surface": {
    "addFunctions": [],
    "addInstructions": [],
    "hideFunctions": [
      "ARRAYMSORTEX","BITMAP_CACHE_ENABLE","CLEARMEMORY","DT_CELL_GET",
      "DT_CELL_GETS","DT_CELL_ISNULL","DT_CELL_SET","DT_CLEAR",
      "DT_COLUMN_ADD","DT_COLUMN_EXIST","DT_COLUMN_LENGTH","DT_COLUMN_NAMES",
      "DT_COLUMN_REMOVE","DT_CREATE","DT_EXIST","DT_FROMXML",
      "DT_NOCASE","DT_RELEASE","DT_ROW_ADD","DT_ROW_LENGTH",
      "DT_ROW_REMOVE","DT_ROW_SET","DT_SELECT","DT_TOXML",
      "ENUMFILES","ENUMFUNCBEGINSWITH","ENUMFUNCENDSWITH","ENUMFUNCWITH",
      "ENUMMACROBEGINSWITH","ENUMMACROENDSWITH","ENUMMACROWITH","ENUMVARBEGINSWITH",
      "ENUMVARENDSWITH","ENUMVARWITH","ERDNAME","EXISTFILE",
      "EXISTFUNCTION","EXISTMETH","EXISTSOUND","EXISTVAR",
      "FLOWINPUT","FLOWINPUTS","GDASHSTYLE","GDRAWGWITHROTATE",
      "GDRAWLINE","GDRAWTEXT","GETDISPLAYLINE","GETDOINGFUNCTION",
      "GETMEMORYUSAGE","GETMETH","GETMETHS","GETTEXTBOX",
      "GETVAR","GETVARS","GGETBRUSH","GGETFONT",
      "GGETFONTSIZE","GGETFONTSTYLE","GGETPEN","GGETPENWIDTH",
      "GGETTEXTSIZE","HOTKEY_STATE","HOTKEY_STATE_INIT","HTML_STRINGLEN",
      "HTML_STRINGLINES","HTML_SUBSTRING","ISDEFINED","MAP_CLEAR",
      "MAP_CREATE","MAP_EXIST","MAP_FROMXML","MAP_GET",
      "MAP_GETKEYS","MAP_HAS","MAP_RELEASE","MAP_REMOVE",
      "MAP_SET","MAP_SIZE","MAP_TOXML","MOUSEB",
      "MOVETEXTBOX","OUTPUTLOG","REGEXPMATCH","RESUMETEXTBOX",
      "SETTEXTBOX","SETVAR","SPRITEDISPOSEALL","VARSETEX",
      "XML_ADDATTRIBUTE","XML_ADDATTRIBUTE_BYNAME","XML_ADDNODE","XML_ADDNODE_BYNAME",
      "XML_DOCUMENT","XML_EXIST","XML_GET","XML_GET_BYNAME",
      "XML_RELEASE","XML_REMOVEATTRIBUTE","XML_REMOVEATTRIBUTE_BYNAME","XML_REMOVENODE",
      "XML_REMOVENODE_BYNAME","XML_REPLACE","XML_REPLACE_BYNAME","XML_SET",
      "XML_SET_BYNAME","XML_TOSTR"
    ],
    "hideInstructions": [
      "ARRAYMSORTEX","BINPUT","BINPUTS","BITMAP_CACHE_ENABLE",
      "BREAKBUTTON","CALLSHARP","CLEARBGIMAGE","CLEARMEMORY",
      "DT_CELL_GET","DT_CELL_GETS","DT_CELL_ISNULL","DT_CELL_SET",
      "DT_CLEAR","DT_COLUMN_ADD","DT_COLUMN_EXIST","DT_COLUMN_LENGTH",
      "DT_COLUMN_NAMES","DT_COLUMN_OPTIONS","DT_COLUMN_REMOVE","DT_CREATE",
      "DT_EXIST","DT_FROMXML","DT_NOCASE","DT_RELEASE",
      "DT_ROW_ADD","DT_ROW_LENGTH","DT_ROW_REMOVE","DT_ROW_SET",
      "DT_SELECT","DT_TOXML","ENUMFILES","ENUMFUNCBEGINSWITH",
      "ENUMFUNCENDSWITH","ENUMFUNCWITH","ENUMMACROBEGINSWITH","ENUMMACROENDSWITH",
      "ENUMMACROWITH","ENUMVARBEGINSWITH","ENUMVARENDSWITH","ENUMVARWITH",
      "ERDNAME","EXISTFILE","EXISTFUNCTION","EXISTMETH",
      "EXISTSOUND","EXISTVAR","FLOWINPUT","FLOWINPUTS",
      "FORCE_BEGIN","FORCE_QUIT","FORCE_QUIT_AND_RESTART","GDASHSTYLE",
      "GDRAWGWITHROTATE","GDRAWLINE","GDRAWTEXT","GETDISPLAYLINE",
      "GETDOINGFUNCTION","GETMEMORYUSAGE","GETMETH","GETMETHS",
      "GETTEXTBOX","GETVAR","GETVARS","GGETBRUSH",
      "GGETFONT","GGETFONTSIZE","GGETFONTSTYLE","GGETPEN",
      "GGETPENWIDTH","GGETTEXTSIZE","HOTKEY_STATE","HOTKEY_STATE_INIT",
      "HTML_PRINT_ISLAND","HTML_PRINT_ISLAND_CLEAR","HTML_STRINGLEN","HTML_STRINGLINES",
      "HTML_SUBSTRING","INPUTANY","ISDEFINED","MAP_CLEAR",
      "MAP_CREATE","MAP_EXIST","MAP_FROMXML","MAP_GET",
      "MAP_GETKEYS","MAP_HAS","MAP_RELEASE","MAP_REMOVE",
      "MAP_SET","MAP_SIZE","MAP_TOXML","MOUSEB",
      "MOVETEXTBOX","ONEBINPUT","ONEBINPUTS","PLAYBGM",
      "PLAYSOUND","PRINTFORMN","PRINTFORMSN","PRINTN",
      "PRINTSN","PRINTVN","QUIT_AND_RESTART","REGEXPMATCH",
      "REMOVEBGIMAGE","RESUMETEXTBOX","SETBGIMAGE","SETBGMVOLUME",
      "SETSOUNDVOLUME","SETTEXTBOX","SETVAR","SKIPLOG",
      "SPRITEDISPOSEALL","STOPBGM","STOPSOUND","TOOLTIP_CUSTOM",
      "TOOLTIP_FORMAT","TOOLTIP_IMG","TOOLTIP_SETFONT","TOOLTIP_SETFONTSIZE",
      "TRYCALLF","TRYCALLFORMF","UPDATECHECK","VARI",
      "VARS","VARSETEX","XML_ADDATTRIBUTE","XML_ADDATTRIBUTE_BYNAME",
      "XML_ADDNODE","XML_ADDNODE_BYNAME","XML_DOCUMENT","XML_EXIST",
      "XML_GET","XML_GET_BYNAME","XML_RELEASE","XML_REMOVEATTRIBUTE",
      "XML_REMOVEATTRIBUTE_BYNAME","XML_REMOVENODE","XML_REMOVENODE_BYNAME","XML_REPLACE",
      "XML_REPLACE_BYNAME","XML_SET","XML_SET_BYNAME","XML_TOSTR"
    ]
  },
  "targetEngineApi": 1
}
